"Y8HLX4ZT","journalArticle","2024","Faur, Sharon; Leggett-James, Mary Page; Kaniušonytė, Goda; Žukauskienė, Rita; Laursen, Brett","00_Perceptions of relationship quality that predict friendship dissolution during childhood and adolescence: Social support matters more than negativity","Developmental Psychology","","1939-0599","10.1037/dev0001676","","The present study examines perceptions of relationship quality as antecedents of best friendship dissolution. Participants included 230 students in Florida (United States; 54.3% girls; ages = 8–13; 39.6% European American, 27.0% Hispanic American, 21.7% African American, and 2.6% Asian American) and 496 students in Lithuania (49.0% girls; ages = 8–14; 358 boys; nearly all ethnic Lithuanian) attending public schools in Florida (United States) and Lithuania. Reciprocated best friends were identified from friend nominations midway through the school year, at which time each partner described perceptions of social support and negativity in the relationship. Of the 363 reciprocated friend dyads, 26.2% (n = 95) were no longer friends 1–3 months later. Dyadic analyses were conducted with initial perceived friend negativity and initial perceived friend social support as predictors of subsequent friendship stability. When considered separately, perceived social support predicted self- and partner reports of friendship stability and perceived negativity predicted self- (but not partner) reports of friendship stability. In each case, lower initial social support and higher initial negativity predicted a greater incidence of friendship dissolution. When considered together, initial perceptions of social support predicted self- and partner reports of friendship dissolution, but perceptions of negativity predicted neither. The findings are consistent with those from married couples, which indicate that the absence of positive interactions is a stronger predictor of relationship instability than the presence of negative interactions. (PsycInfo Database Record (c) 2025 APA, all rights reserved)","2024","2025-07-15 03:36:42","2025-07-29 12:29:09","","560-566","","3","60","","","Perceptions of relationship quality that predict friendship dissolution during childhood and adolescence","","","","","","","en-US","","","","","APA PsycNet","","Place: US Publisher: American Psychological Association","","D:\soft\Zotero\保存目录\storage\JN7ZM5ZU\Faur 等 - 2024 - Perceptions of relationship quality that predict friendship dissolution during childhood and adolesc.pdf","","","Social Support; Adolescent Attitudes; Child Attitudes; Friendship; Relationship Quality; Negativism","","","","","","","","","","","","","","","","","","","","","","","","","","","","","","","","","","","","","","","","","","","","","",""
"4YFBI8LX","journalArticle","2024","Lany, Jill; Karaman, Ferhat; Hay, Jessica F.","00_A changing role for transitional probabilities in word learning during the transition to toddlerhood?","Developmental Psychology","","1939-0599","10.1037/dev0001641","","Infants’ sensitivity to transitional probabilities (TPs) supports language development by facilitating mapping high-TP (HTP) words to meaning, at least up to 18 months of age. Here we tested whether this HTP advantage holds as lexical development progresses, and infants become better at forming word–referent mappings. Two groups of 24-month-olds (N = 64 and all White, tested in the United States) first listened to Italian sentences containing HTP and low-TP (LTP) words. We then used HTP and LTP words, and sequences that violated these statistics, in a mapping task. Infants learned HTP and LTP words equally well. They also learned LTP violations as well as LTP words, but learned HTP words better than HTP violations. Thus, by 2 years of age sensitivity to TPs does not lead to an HTP advantage but rather to poor mapping of violations of HTP word forms. (PsycInfo Database Record (c) 2024 APA, all rights reserved)","2024","2025-07-15 03:36:42","2025-07-29 12:29:48","","567-581","","3","60","","","","","","","","","","en-US","","","","","APA PsycNet","","Place: US Publisher: American Psychological Association","","D:\soft\Zotero\保存目录\storage\HMA3GBIY\Lany 等 - 2024 - A changing role for transitional probabilities in word learning during the transition to toddlerhood.pdf","","","Infant Development; Early Childhood Development; Language Development; Probability Learning; Word Meaning; Words (Phonetic Units)","","","","","","","","","","","","","","","","","","","","","","","","","","","","","","","","","","","","","","","","","","","","","",""
"ADRUP2EC","journalArticle","2024","Hamilton, Mollie; Roper, Tessyia; Blaser, Erik; Kaldy, Zsuzsa","00_Can’t get it out of my head: Proactive interference in the visual working memory of 3- to 8-year-old children","Developmental Psychology","","1939-0599","10.1037/dev0001686","","Proactive interference (PI) occurs when previously learned memories compete with currently relevant information. Despite extensive literature investigating the effect in adults, little work has been done in young children. In three preregistered studies (N = 38, 35, 172; convenience samples from the Northeastern United States), first, we showed that 3-year-old toddlers are highly sensitive to the effect of PI in visual working memory and second, that these effects can originate from the reactivation of previously encoded information. Third, we tested how the ability to cope with PI changes between 2.5 and 7.5 years of age. Besides providing an estimate for the size of the interference effect at the youngest age to date, our findings have an important methodological implication: paradigms that repeat items across trials potentially underestimate young children’s working memory abilities. (PsycInfo Database Record (c) 2024 APA, all rights reserved)","2024","2025-07-15 03:36:42","2025-07-29 12:30:45","","582-594","","3","60","","","Can’t get it out of my head","","","","","","","en-US","","","","","APA PsycNet","","Place: US Publisher: American Psychological Association","","D:\soft\Zotero\保存目录\storage\JGYKVFIV\Hamilton 等 - 2024 - Can’t get it out of my head Proactive interference in the visual working memory of 3- to 8-year-old.pdf","","","Cognitive Control; Child Psychology; Interference (Learning); Short Term Memory; Visual Memory","","","","","","","","","","","","","","","","","","","","","","","","","","","","","","","","","","","","","","","","","","","","","",""
"YQVKL8BC","journalArticle","2024","Suarez, Gabriela L.; Burt, S. Alexandra; Gard, Arianna M.; Klump, Kelly L.; Hyde, Luke W.","00_Exposure to community violence as a mechanism linking neighborhood disadvantage to amygdala reactivity and the protective role of parental nurturance","Developmental Psychology","","1939-0599","10.1037/dev0001712","","Emerging literature links neighborhood disadvantage to altered neural function in regions supporting socioemotional and threat processing. Few studies, however, have examined the proximal mechanisms through which neighborhood disadvantage is associated with neural functioning. In a sample of 7- to 19-year-old twins recruited from disadvantaged neighborhoods (354 families, 708 twins; 54.5% boys; 78.5% White, 13.0% Black, 8.5% other racial/ethnic group membership), we found that exposure to community violence was related to increased amygdala reactivity during socioemotional processing and may be one mechanism linking neighborhood disadvantage to amygdala functioning. Importantly, parenting behavior appeared to modulate these effects, such that high parental nurturance buffered the effect of exposure to community violence on amygdala reactivity. These findings elucidate the potential impact of exposure to community violence on brain function and highlight the role parents can play in protecting youth from the neural effects of exposure to adversity. (PsycInfo Database Record (c) 2025 APA, all rights reserved)","2024","2025-07-15 03:38:05","2025-07-29 12:31:03","","595-609","","4","60","","","","","","","","","","en-US","","","","","APA PsycNet","","Place: US Publisher: American Psychological Association","","D:\soft\Zotero\保存目录\storage\5S4UCWL7\Suarez 等 - 2024 - Exposure to community violence as a mechanism linking neighborhood disadvantage to amygdala reactivi.pdf","","","Twins; Exposure to Violence; Neighborhoods; Parenting; Amygdala; Disadvantaged; Nurturance; Parental Role","","","","","","","","","","","","","","","","","","","","","","","","","","","","","","","","","","","","","","","","","","","","","",""
"Z76FDNG4","journalArticle","2024","Shewark, Elizabeth A.; Vazquez, Alexandra Y.; Pearson, Amber L.; Klump, Kelly L.; Burt, S. Alexandra","00_Neighborhood features moderate genetic and environmental influences on children’s social information processing","Developmental Psychology","","1939-0599","10.1037/dev0001690","","Neighborhood is a key context where children learn to process social information; however, the field has largely overlooked the ways children’s individual characteristics might be moderated by neighborhood effects. We examined 1,030 six- to 11-year-olds (48.7% female; 82% White) twin pairs oversampled for neighborhood disadvantage from the Twin Study of Behavioral and Emotional Development in Children. We evaluated neighbor reports (N = 1,880) of neighborhood structural and social characteristics as moderators of genetic and environmental influences on children’s social processing. Although there was no evidence of moderation for children’s hostile attributions, there was robust evidence that the social and structural characteristics of the neighborhood moderated the genetic and environmental origins of children’s positive expectations of aggressive behavior. Specifically, we found that genetic influences on aggressive expectations increased in the presence of neighborhood deprivation and decreased in the presence of protective social processes and availability of resources. Such findings suggest that protective neighborhood social processes may buffer against the development of aggressive expectations during middle childhood by suppressing the expression of genetic influences on those outcomes. In doing so, they suggest that neighborhood social processes may be able to promote youth resilience to neighborhood deprivation “under the skin.” (PsycInfo Database Record (c) 2025 APA, all rights reserved)","2024","2025-07-15 03:38:05","2025-07-29 12:31:58","","610-623","","4","60","","","","","","","","","","en-US","","","","","APA PsycNet","","Place: US Publisher: American Psychological Association","","D:\soft\Zotero\保存目录\storage\CJ5CAIP7\Shewark 等 - 2024 - Neighborhood features moderate genetic and environmental influences on children’s social information.pdf","","","Twins; Social Cognition; Childhood Development; Neighborhoods; Genetics; Social Deprivation; Social Influences; Social Processes","","","","","","","","","","","","","","","","","","","","","","","","","","","","","","","","","","","","","","","","","","","","","",""
"RGJ852ZP","journalArticle","2024","Perry, Sylvia; Wu, Deborah J.; Abaied, Jamie L.; Skinner-Dorkenoo, Allison L.; Sanchez, Sirenia; Waters, Sara F.; Osnaya, Adilene","00_White parents’ racial socialization during a guided discussion predicts declines in white children’s pro-white biases","Developmental Psychology","","1939-0599","10.1037/dev0001703","","Although parent–child conversations about race are recommended to curb White U.S. children’s racial biases, little work has tested their influence. We designed a guided racism discussion task for U.S. White parents and their 8–12-year-old White children. We explored whether children’s and parents’ (a) pro-White implicit biases changed pre to postconversation, (b) racial socialization messages (color conscious, external attributions for prejudiced behavior and colorblind racial ideology [CBRI]) predicted changes in each other’s implicit biases, and (c) associations varied by the type of racism (subtle vs. blatant) discussed. Children’s and parents’ biases significantly declined, pre to postdiscussion. Parents’ color conscious messages predicted greater declines and messages reflecting CBRI and external attributions predicted smaller declines in children’s bias. These patterns were observed during discussions of subtle, but not blatant bias. Effects of children’s messages on parents’ bias were mixed. Our findings suggest that color conscious parent–child discussions may effectively reduce implicit pro-White bias in White children. (PsycInfo Database Record (c) 2025 APA, all rights reserved)","2024","2025-07-15 03:38:05","2025-07-29 12:32:49","","624-636","","4","60","","","","","","","","","","en-US","","","","","APA PsycNet","","Place: US Publisher: American Psychological Association","","D:\soft\Zotero\保存目录\storage\NVLHHAZ6\Perry 等 - 2024 - White parents’ racial socialization during a guided discussion predicts declines in white children’s.pdf","","","White People; Socialization; Parent Child Relations; Attribution; Consciousness States; Implicit Bias; Messages; Racism","","","","","","","","","","","","","","","","","","","","","","","","","","","","","","","","","","","","","","","","","","","","","",""
"BRXGE2YV","journalArticle","2024","Elenbaas, Laura; Hitti, Aline; Kneeskern, Ellen; Ackerman, Amanda; Fisher, Kayla; Cao, Jason; Irwin, Charlotte","00_“Honestly, they are just like us”: U.S. parents choose middle-class gender and racial ingroup peers for their children","Developmental Psychology","","1939-0599","10.1037/dev0001724","","Children and adolescents benefit from positive intergroup peer interactions, but they are unlikely to have many opportunities for these interactions if their parents are uncomfortable with them. Drawing primarily on social identity theory (SIT), this study investigated how U.S. parents’ (N = 569) comfort with their children’s potential intergroup peer interactions (a) differed by child and peer group gender (boy, girl), race (Black, White), and social class (higher-, middle-, or lower-subjective social status), (b) changed over the transition from childhood to adolescence (8–10, 11–13, and 14–16 years), and (c) varied by context intimacy (hanging out vs. sleeping over). The sample was equally balanced between parents of children reflecting those same group memberships. Consistent with SIT, when asked to choose, parents were typically most comfortable with their child spending time with middle-class peers who shared their child’s gender and racial ingroup membership. Moreover, parents often explained their decisions with reference to similarities between these peers and their own child or family. Parents’ comfort did not differ systematically by child age, but many parents were less comfortable with cross-gender peer interactions in the more intimate sleepover context than the less intimate hangout context. All groups of parents also exhibited at least some openness to cross-group interactions. These findings advance developmental scientists’ understanding of parents’ roles as potential facilitators or gatekeepers of their children’s intergroup peer interactions. (PsycInfo Database Record (c) 2025 APA, all rights reserved)","2024","2025-07-15 03:38:05","2025-07-29 12:33:35","","637-648","","4","60","","","“Honestly, they are just like us”","","","","","","","en-US","","","","","APA PsycNet","","Place: US Publisher: American Psychological Association","","D:\soft\Zotero\保存目录\storage\FEU7J3C9\Elenbaas 等 - 2024 - “Honestly, they are just like us” U.S. parents choose middle-class gender and racial ingroup peers.pdf","","","Parents; Peers; Peer Relations; Intergroup Dynamics; Parental Attitudes; Racial and Ethnic Relations; Social Class; Social Identity","","","","","","","","","","","","","","","","","","","","","","","","","","","","","","","","","","","","","","","","","","","","","",""
"APIZKD32","journalArticle","2024","Dai, Junqiang; Griffin, Jason W.; Scherf, K. Suzanne","03_How is race perceived during adolescence? A meta-analysis of the own-race bias","Developmental Psychology","","1939-0599","10.1037/dev0001721","","Adolescence is a critical developmental period that is marked by drastic changes in face recognition, which are reflected in patterns of bias (i.e., superior recognition for some individuals compared to others). Here, we evaluate how race is perceived during face recognition and whether adolescents exhibit an own-race bias (ORB). We conducted a Bayesian meta-analysis to estimate the summary effect size of the ORB across 16 unique studies (38 effect sizes) with 1,321 adolescent participants between the ages of ∼10–22 years of age. This meta-analytic approach allowed us to inform the analysis with prior findings from the adult literature and evaluate how well they fit the adolescent literature. We report a positive, small ORB (Hedges’s g = 0.24) that was evident under increasing levels of uncertainty in the analysis. The magnitude of the ORB was not systematically impacted by participant age or race, which is inconsistent with predictions from perceptual expertise and social cognitive theories. Critically, our findings are limited in generalizability by the study samples, which largely include White adolescents in White-dominant countries. Future longitudinal studies that include racially diverse samples and measure social context, perceiver motivation, peer reorientation, social network composition, and ethnic–racial identity development are critical for understanding the presence, magnitude, and relative flexibility of the ORB in adolescence. (PsycInfo Database Record (c) 2025 APA, all rights reserved)","2024","2025-07-15 03:38:05","2025-07-29 12:34:03","","649-664","","4","60","","","How is race perceived during adolescence?","","","","","","","en-US","","","","","APA PsycNet","","Place: US Publisher: American Psychological Association","","D:\soft\Zotero\保存目录\storage\3SNUS73J\Dai 等 - 2024 - How is race perceived during adolescence A meta-analysis of the own-race bias.pdf","","","Face Perception; Adolescent Development; Adolescent Attitudes; Racial Bias","","","","","","","","","","","","","","","","","","","","","","","","","","","","","","","","","","","","","","","","","","","","","",""
"MLU4BEKT","journalArticle","2024","Starr, Alexandra; Haider, Zainab F.; von Stumm, Sophie","01_Do school grades matter for growing up? Testing the predictive validity of school performance for outcomes in emerging adulthood","Developmental Psychology","","1939-0599","10.1037/dev0001548","","In putatively meritocratic societies, doing well in school is a pivotal precondition for accessing further and higher education, which, in turn, has a pervasive, long-term influence on adulthood development. Yet, doing well in school may also predict “real-life success” outside formal education settings and independent of the educational qualifications that a person attains. Such predictions are likely to become salient during emerging adulthood, a life period characterized by career explorations and social-emotional adjustment. Here, we tested the predictive validity of end-of-compulsory school grades at age 16 years in a U.K.-representative population cohort sample of up to N = 6,488, who were born between 1994 and 1996, for a broad range of occupational, financial, and social-emotional outcomes at age 23. End-of-compulsory school performance accounted for 1%–20% of the variance across occupational, financial, and social-emotional outcomes in emerging adulthood. Educational attainment attenuated these associations only slightly, with school grades at age 16 accounting for variance in emerging adulthood outcomes independent of later educational attainment. We found that school grades were equally predictive for boys’ and girls’ outcomes. In children from lower family socioeconomic status (SES) backgrounds, school grades were more predictive of their educational attainment, financial attitudes, and anxiety compared to higher SES children, with varying effect sizes (i.e., 0.3%–4.2%). Our findings suggest that school-leaving grades facilitate the successful transition from adolescence to adulthood, independent of educational attainment, and that they might enable children from low-SES families to compensate for some of their background disadvantages. (PsycInfo Database Record (c) 2024 APA, all rights reserved)","2024","2025-07-15 03:38:05","2025-07-30 04:57:35","","665-679","","4","60","","","Do school grades matter for growing up?","","","","","","","en-US","","","","","APA PsycNet","","Place: US Publisher: American Psychological Association","","D:\soft\Zotero\保存目录\storage\B6ZVV53G\Starr 等 - 2024 - Do school grades matter for growing up Testing the predictive validity of school performance for ou.pdf","","","Prediction; Emerging Adulthood; Educational Attainment Level; Socioeconomic Status; Academic Achievement; Predictive Validity; Socioemotional Functioning","","","","","","","","","","","","","","","","","","","","","","","","","","","","","","","","","","","","","","","","","","","","","",""
"QXM4KDGN","journalArticle","2024","Wu, Jiawen; Oh, Dajung (Diana); Hyde, Daniel C.; Pomerantz, Eva M.","00_Cognitive and motivational numeracy parenting practices: Implications for children’s numeracy engagement during early elementary school","Developmental Psychology","","1939-0599","10.1037/dev0001706","","Parents are considered a major resource in children’s numeracy development. The relative role of cognitive and motivational parenting practices, however, is unclear given that the two types of practices have largely been studied in isolation. The current study simultaneously estimated the contributions of several cognitive and motivational parenting practices hypothesized to be important, but which may have overlapping effects. To capture parents’ cognitive practices, the level and structure (i.e., prompts vs. statements) of 529 American parents’ (80% mothers; 65% White, 20% Black; 33% less than a bachelor’s degree) numeracy talk was coded during a challenging numeracy activity. Parents’ motivational practices were assessed by coding their autonomy support and control in the activity. Children’s (Mage = 7.5 years; 49% girls) engagement of numeracy strategies was also coded. Multilevel minute-to-minute modeling predicting children’s engagement from both cognitive and motivational parenting practices indicated that parents’ cognitive practices, particularly advanced prompts, predicted children’s subsequent engagement of numeracy strategies, which were often advanced. Parents’ motivational practices, as reflected in their autonomy support (vs. control), also foreshadowed children’s engagement. These effects of the two types of practices were independent of one another. Taken together, the findings are consistent with the idea that cognitive and motivational parenting practices provide distinct resources that can benefit children’s math learning. (PsycInfo Database Record (c) 2024 APA, all rights reserved)","2024","2025-07-15 03:38:05","2025-07-29 12:37:01","","680-692","","4","60","","","Cognitive and motivational numeracy parenting practices","","","","","","","en-US","","","","","APA PsycNet","","Place: US Publisher: American Psychological Association","","D:\soft\Zotero\保存目录\storage\TU83VEQM\Wu 等 - 2024 - Cognitive and motivational numeracy parenting practices Implications for children’s numeracy engage.pdf","","","Parents; Motivation; Cognition; Early Childhood Development; Mathematics; Autonomy; Childrearing Practices","","","","","","","","","","","","","","","","","","","","","","","","","","","","","","","","","","","","","","","","","","","","","",""
