"9WJL7WZY","journalArticle","2024","Ravindran, Niyantri; McElwain, Nancy L.","00_Dynamic coupling of maternal sensitivity and toddlers’ responsive/assertive behaviors predicts children’s behavior toward peers during the preschool years","Developmental Psychology","","1939-0599","10.1037/dev0001809","","We examined the extent to which dynamic coupling of (a) maternal sensitivity and (b) children’s responsive and assertive behaviors toward mothers during a semistructured play session predicts children’s responsive and assertive behavior toward an unfamiliar peer at 39 months and a close friend at 58 and 66 months. Maternal and child behaviors were rated in 30-s epochs during play when children were 32 months old (Time 1; N = 128; 66 girls). Children were rated on their responsiveness and assertiveness toward an unfamiliar peer in the early preschool years (Time 2) and toward a friend in the late preschool years (Time 3). Residual dynamic structural equation models showed that stronger positive contemporaneous coupling of maternal sensitivity and children’s responsiveness in a given 30-s epoch of the play session predicted greater observed responsiveness toward a friend in the late preschool years, after controlling for mean levels of maternal sensitivity and child responsiveness. On the other hand, positive contemporaneous coupling of maternal sensitivity and child assertiveness predicted children’s higher levels of observed assertiveness toward an unfamiliar peer in the early preschool years, after controlling for mean levels of maternal sensitivity and child assertiveness. Results suggest that the dynamic coupling of specific positive behaviors during mother–child interaction may provide children with social scripts to draw on in diverse peer contexts. (PsycInfo Database Record (c) 2024 APA, all rights reserved)","2024","2025-07-15 03:47:59","2025-07-30 04:34:08","","1801-1813","","10","60","","","","","","","","","","en-US","","","","","APA PsycNet","","Place: US Publisher: American Psychological Association","","D:\soft\Zotero\保存目录\storage\JQEMD7H9\Ravindran和McElwain - 2024 - Dynamic coupling of maternal sensitivity and toddlers’ responsiveassertive behaviors predicts child.pdf","","","Structural Equation Modeling; Early Childhood Development; Mothers; Peers; Child Behavior; Mother Child Relations; Assertiveness; Childhood Play Behavior","","","","","","","","","","","","","","","","","","","","","","","","","","","","","","","","","","","","","","","","","","","","","",""
"7HZAWUJ7","journalArticle","2024","Li, Longfeng; Degirmencioglu, Kivilcim; Lunkenheimer, Erika","00_Observed child behavioral self-regulation and maternal supportive parenting are associated with dynamic physiological stress reactivity in preschoolers","Developmental Psychology","","1939-0599","10.1037/dev0001770","","This study sought to advance our understanding of how observed child self-regulation, parenting, and their interaction were associated with children’s dynamic physiological stress reactivity indexed by respiratory sinus arrhythmia (RSA) reactivity trajectories. Participants were 85 three-year-old children (54% female) and their mothers oversampled for lower income, higher stressful life events, and higher child maltreatment risk. Child behavioral regulation, assessed as compliance and noncompliance, and maternal supportive parenting were observed during a challenging dyadic puzzle task. Results showed that child RSA exhibited quadratic change across the task on average, characterized by an expected initial decrease and subsequent recovery. Child behavioral regulation and its interaction with maternal supportive parenting were associated with interindividual differences in child RSA reactivity trajectories after controlling for child resting RSA. Children with higher compliance or lower noncompliance showed RSA decreases in response to task stressors but exhibited subsequent RSA recovery only when mothers displayed higher supportive parenting. Children with lower compliance or higher noncompliance displayed negligible RSA changes overall across the task, suggesting blunted or compromised RSA reactivity, regardless of supportive parenting levels. These findings demonstrate novel evidence that preschoolers’ better behavioral regulation is related to their more adaptive physiological reactivity to stressors and that supportive parenting is needed to facilitate physiological recovery even in relatively better-regulated preschoolers. (PsycInfo Database Record (c) 2024 APA, all rights reserved)","2024","2025-07-15 03:47:59","2025-07-30 04:34:15","","1814-1826","","10","60","","","","","","","","","","en-US","","","","","APA PsycNet","","Place: US Publisher: American Psychological Association","","D:\soft\Zotero\保存目录\storage\SNLGHQTF\Li 等 - 2024 - Observed child behavioral self-regulation and maternal supportive parenting are associated with dyna.pdf","","","Heart Rate; Childhood Development; Parenting; Self-Regulation; Mother Child Relations; Heart Arrhythmias; Physiological Stress; Respiration","","","","","","","","","","","","","","","","","","","","","","","","","","","","","","","","","","","","","","","","","","","","","",""
"WGEQJRAR","journalArticle","2024","Stallworthy, Isabella C.; Elison, Jed T.; Berry, Daniel","00_The infant parasympathetic nervous system is socially embedded and dynamic at multiple timescales, within and between people","Developmental Psychology","","1939-0599","10.1037/dev0001787","","Human interpersonal capacities emerge from coordinated neural, biological, and behavioral activity unfolding within and between people. However, developmental research to date has allocated comparatively little focus to the dynamic processes of how social interactions emerge across these levels of analysis. Second-person neuroscience and dynamic systems approach together to offer an integrative framework for addressing these questions. This study quantified respiratory sinus arrhythmia and social behavior (∼360 observations per system) from 44 mothers and typically developing 9-month-old infants during a novel modified “still-face” (text message perturbation) task. Stochastic autoregression models indicate that the infant parasympathetic nervous system is coupled within and between people second by second and is sensitive to social context. Intraindividual, we found positive coupling between infants’ parasympathetic nervous system activity and their social behavior in the subsequent second, but only during the moments and periods of active caregiver engagement. Between people, we found a bidirectional coregulatory feedback loop: Mothers’ parasympathetic activity positively predicted that of their infant in the subsequent second, a form of synchrony that decreased during the text message perturbation and did not fully recover. Conversely, infant parasympathetic activity negatively predicted that of their mother at the subsequent second, a form of synchrony that was invariant over social context. Findings reveal unidirectional parasympathetic coupling within infants and a complementary allostatic feedback loop between mother and infant parasympathetic systems. They offer novel evidence of a dynamic, socially embedded parasympathetic system at previously undocumented timescales, contributing to both basic science and potential clinical targets to better support adaptive, multisystem social development. (PsycInfo Database Record (c) 2024 APA, all rights reserved)","2024","2025-07-15 03:47:59","2025-07-30 04:34:04","","1827-1841","","10","60","","","","","","","","","","en-US","","","","","APA PsycNet","","Place: US Publisher: American Psychological Association","","D:\soft\Zotero\保存目录\storage\RFHCTE2G\Stallworthy 等 - 2024 - The infant parasympathetic nervous system is socially embedded and dynamic at multiple timescales, w.pdf","","","Feedback; Parasympathetic Nervous System; Infant Development; Social Behavior; Mothers; Psychological Engagement; Synchrony; Text Messaging","","","","","","","","","","","","","","","","","","","","","","","","","","","","","","","","","","","","","","","","","","","","","",""
"PZ724GEI","journalArticle","2024","Hoffman, Adam J.; Schacter, Hannah L.","00_The promise of an identity-based self-affirmation intervention in protecting against self-esteem declines at the high school transition","Developmental Psychology","","1939-0599","10.1037/dev0001789","","Given the importance of self-esteem for promoting adolescents’ social, psychological, and academic adjustment and the growing importance of social identities during adolescence, this five-wave study examined whether an identity-based self-affirmation intervention attenuated declines in adolescent self-esteem following the high school transition. A sample of ninth graders in the United States (N = 388; Mage = 14.05; 60.6% female; 35.8% male; 3.6% nonbinary, trans, or identifying with another gender; 46% White, 19% Black, 17% Asian, 6% Arab, Middle Eastern, North African, 6% Biracial/Multiethnic, 3% Latinx/Hispanic, and 3% another race/ethnicity) was recruited for the study. Following completion of a baseline online survey assessing self-esteem, participants were assigned to one of three conditions and corresponding writing exercises: identity-based self-affirmation, values-based self-affirmation, or control. Participants completed the same writing exercise during the first three waves of the study, and they completed measures of self-esteem at all five waves. Results indicated that participants in the self-affirmation conditions, but not the control condition, were protected from declining self-esteem across 1 year. (PsycInfo Database Record (c) 2024 APA, all rights reserved)","2024","2025-07-15 03:47:59","2025-07-30 04:33:58","","1842-1854","","10","60","","","","","","","","","","en-US","","","","","APA PsycNet","","Place: US Publisher: American Psychological Association","","D:\soft\Zotero\保存目录\storage\3NALSG8D\Hoffman和Schacter - 2024 - The promise of an identity-based self-affirmation intervention in protecting against self-esteem dec.pdf","","","Adolescent Development; Identity Formation; Social Identity; Adolescent Psychology; Exercise; High School Students; Self-Affirmation; Self-Esteem","","","","","","","","","","","","","","","","","","","","","","","","","","","","","","","","","","","","","","","","","","","","","",""
"KFBAYMHA","journalArticle","2024","Bañales, Josefina; Saleem, Muniba; Murrar, Sohad; Rivas-Drake, Deborah; Pinetta, Bernardette J.","00_Social identity development and religious discrimination among Muslim American youth","Developmental Psychology","","1939-0599","10.1037/dev0001806","","The present study investigated the development of social identity centrality dimensions (i.e., Muslim, ethnic, and American identity centrality) among Muslim American youth as well as associations between religious discrimination and social identity centrality trajectories. Data were collected once annually from 2015 to 2017 with 220 Muslim American youth (M = 14.20, SD = 0.94) in the Midwest United States (girls = 53.2%; boys = 42.3%; missing = 4.5%). Participants were Arab (62.3%), Somali (15.9%), and African American (8.6%), among other ethnic groups (less than 2%). Latent growth curve models indicated that Muslim and ethnic identity centrality displayed negative trajectories and that American identity centrality increased over time. Surprisingly, religious discrimination was not associated with social identity centrality trajectories. This research suggests that Muslim American youths’ minoritized social identities develop similarly, whereas youths’ American social identity develops differently than these identities. (PsycInfo Database Record (c) 2024 APA, all rights reserved)","2024","2025-07-15 03:47:59","2025-07-30 04:33:54","","1855-1869","","10","60","","","","","","","","","","en-US","","","","","APA PsycNet","","Place: US Publisher: American Psychological Association","","D:\soft\Zotero\保存目录\storage\7ZUHFEN5\Bañales 等 - 2024 - Social identity development and religious discrimination among Muslim American youth.pdf","","","Race and Ethnic Discrimination; Adolescent Development; Identity Formation; Social Identity; Ethnic Identity; Muslim Americans","","","","","","","","","","","","","","","","","","","","","","","","","","","","","","","","","","","","","","","","","","","","","",""
"LMNND4XE","journalArticle","2024","Booker, Jordan A.; Fivush, Robyn; Greenhoot, Andrea Follmer; McLean, Kate C.; Wainryb, Cecilia; Pasupathi, Monisha","00_Emerging adults’ journeys out of the shutdown: Longitudinal narrative patterns in a college career defined by COVID-19","Developmental Psychology","","1939-0599","10.1037/dev0001767","","The COVID-19 pandemic has defined the college career for this generation of learners, threatening mental health, identity development, and college functioning. We began tracking the impacts of this pandemic for 633 first-year college students from four U.S. universities (Mage = 18.8 years) in Spring 2020 and followed students to Spring 2023. Students provided narratives about the impacts of COVID-19 and reports of mental health concerns, identity development, well-being. Students reported concerns for mental health, identity, and well-being during the first year of COVID-19 impacts. The return to in-person activities predicted broad increases in narrative growth and concomitant decreases in COVID-19 stressors, increases in identity exploration and commitment, and increases in psychological and academic well-being. Changes in COVID-19 stressors and narrative growth served as mediators between the return to in-person activities around campus and student outcomes. Findings expand insights of development and mental health across much of this generation-defining event. (PsycInfo Database Record (c) 2024 APA, all rights reserved)","2024","2025-07-15 03:47:59","2025-07-30 04:33:49","","1870-1884","","10","60","","","Emerging adults’ journeys out of the shutdown","","","","","","","en-US","","","","","APA PsycNet","","Place: US Publisher: American Psychological Association","","D:\soft\Zotero\保存目录\storage\QRDYP5NH\Booker 等 - 2024 - Emerging adults’ journeys out of the shutdown Longitudinal narrative patterns in a college career d.pdf","","","Mental Health; COVID-19; Pandemics; Well Being; Narratives; Colleges; Identity Formation; College Students","","","","","","","","","","","","","","","","","","","","","","","","","","","","","","","","","","","","","","","","","","","","","",""
"RJKS6463","journalArticle","2024","Maheux, Anne J.; Burnell, Kaitlyn; Choukas-Bradley, Sophia","00_Bidirectional associations between online and offline appearance concerns during early-to-middle adolescence","Developmental Psychology","","1939-0599","10.1037/dev0001795","","During early and middle adolescence, individuals are at heightened risk of poor body image and subsequent negative mental health outcomes, and the highly visual nature of social media may play a role in this process. It remains unclear, however, if appearance preoccupation on social media—such as appearance-related social media consciousness (ASMC)—influences offline body image, or if preexisting body image concerns influence online appearance preoccupation. The present study investigated between-person differences and potential bidirectional within-person associations in these experiences among eighth grade adolescents in the United States (n = 1,582; ages 11–15 years old; Mage = 13; 47.5% girls, 45.9% boys, 6.5% another gender identity; 37% Latine, 32% White, 18% Black, 7% Asian, 6% another racial/ethnic identity). Participants completed a longitudinal study over three waves within one academic year. Results indicated that within-person increases in ASMC preceded within-person increases in appearance-contingent self-worth and were bidirectionally associated with worse appearance esteem, with no differences in these associations by gender. Among girls only, self-objectification was associated with subsequent within-person increases in ASMC, but not vice versa. Findings indicate that online appearance preoccupation may influence and be reinforced by general body image concerns. (PsycInfo Database Record (c) 2024 APA, all rights reserved)","2024","2025-07-15 03:47:59","2025-07-30 04:33:45","","1885-1901","","10","60","","","","","","","","","","en-US","","","","","APA PsycNet","","Place: US Publisher: American Psychological Association","","D:\soft\Zotero\保存目录\storage\NULXDJNR\Maheux 等 - 2024 - Bidirectional associations between online and offline appearance concerns during early-to-middle ado.pdf","","","Human Sex Differences; Adolescent Development; Social Media; Early Adolescence; Body Image; Media Exposure; Physical Appearance","","","","","","","","","","","","","","","","","","","","","","","","","","","","","","","","","","","","","","","","","","","","","",""
"7D6LEZGP","journalArticle","2024","Blackburn, Melissa; Zinga, Dawn; Molnar, Danielle S.","00_“With texting, I am always second guessing myself”: Teenage perfectionists’ experiences of (dis)connection online","Developmental Psychology","","1939-0599","10.1037/dev0001741","","Little is known about how perfectionistic adolescents experience social connection in online spaces. The current qualitative study addressed this gap by examining themes related to social (dis)connection in online and in-person settings from semistructured interviews with 43 adolescents (Mage = 15.16, SD = 2.43; 62.8% female; 58.1% white; 54.4% self-identified perfectionists). Results demonstrated that perfectionists expressed feeling less connected online than nonperfectionists, likely driven by heightened levels of interpersonal sensitivity. However, a subgroup of perfectionists sought out meaningful online relationships, often in response to a fear or experience of rejection by in-person peers. The results highlight the role of interpersonal sensitivity in fueling feelings of disconnection among adolescent perfectionists in both online and in-person settings, as well as the importance of self-monitoring in the social experiences of perfectionistic youth. (PsycInfo Database Record (c) 2024 APA, all rights reserved)","2024","2025-07-15 03:47:59","2025-07-30 04:33:36","","1902-1914","","10","60","","","“With texting, I am always second guessing myself”","","","","","","","en-US","","","","","APA PsycNet","","Place: US Publisher: American Psychological Association","","D:\soft\Zotero\保存目录\storage\DIJ8MIKB\Blackburn 等 - 2024 - “With texting, I am always second guessing myself” Teenage perfectionists’ experiences of (dis)conn.pdf","","","Adolescent Behavior; Interpersonal Interaction; Social Media; Social Behavior; Perfectionism; Social Connectedness; Social Perception","","","","","","","","","","","","","","","","","","","","","","","","","","","","","","","","","","","","","","","","","","","","","",""
"UE64K8T8","journalArticle","2024","Ho, Pauline; Brown, B. Bradford","00_Black youths’ ethnic and racial identity development from childhood to emerging adulthood","Developmental Psychology","","1939-0599","10.1037/dev0001765","","This qualitative study employed a retrospective inquiry design to trace changes in the course of ethnic and racial identity (ERI) development of 20 African American college students (18–22 years old) attending a large, predominantly White university in the Midwestern United States. Through interviews, participants recalled life experiences that they considered crucial to their understanding of their own ERI in childhood, adolescence, and emerging adulthood. Using longitudinal qualitative analysis, three distinct pathways of ERI development were identified: consolidating (no change to the understanding they developed earlier in life), cumulative (successive additions or expansions to their current understanding of their own ERI), and transformative (their ERI trajectory is qualitatively altered by a turning point event). Results revealed that the development of ERI components is influenced by the interplay of contextual, individual, and developmental factors, along with the ongoing meaning-making of identity-relevant experiences. Findings lend empirical support for adopting a lifespan approach to ERI development, demonstrating ERI development as a dynamically interactive and continuous process. (PsycInfo Database Record (c) 2024 APA, all rights reserved)","2024","2025-07-15 03:47:59","2025-07-30 04:33:40","","1915-1927","","10","60","","","","","","","","","","en-US","","","","","APA PsycNet","","Place: US Publisher: American Psychological Association","","D:\soft\Zotero\保存目录\storage\S5WMHL7I\Ho和Brown - 2024 - Black youths’ ethnic and racial identity development from childhood to emerging adulthood.pdf","","","Early Experience; Life Span; Childhood Development; Black People; Emerging Adulthood; Identity Formation; Ethnic Identity; Racial Identity","","","","","","","","","","","","","","","","","","","","","","","","","","","","","","","","","","","","","","","","","","","","","",""
"X6TWEZL7","journalArticle","2024","Lei, Ryan F.; Cohen, Aaron J.; Wong, Peony; Hudson, Sa-kiera Tiarra Jolynn","00_Investigating hair cues as a mechanism underlying Black women’s intersectional invisibility","Developmental Psychology","","1939-0599","10.1037/dev0001729","","Children psychologically exclude Black women from their representations of women, but the mechanisms underlying this marginalization remain unclear. Across two studies (N = 129; 49 boys, 78 girls, two gender unreported; 79 White, 27 Black, six Latinx, five Asian, and 12 unreported), the present work tests hair texture as one possible perceptual mechanism by which this might occur. In both studies, children gender-categorized Black, White, and Asian men and women using MouseTracker. Children were slower and had more complex patterns in categorizing Black women when they had textured hair (Study 1A), but not when they had straight hair (Study 1B). Implications for the development of gender as a social category are discussed. (PsycInfo Database Record (c) 2024 APA, all rights reserved)","2024","2025-07-15 03:47:59","2025-07-30 04:33:30","","1928-1934","","10","60","","","","","","","","","","en-US","","","","","APA PsycNet","","Place: US Publisher: American Psychological Association","","D:\soft\Zotero\保存目录\storage\G2URDJ7G\Lei 等 - 2024 - Investigating hair cues as a mechanism underlying Black women’s intersectional invisibility.pdf","","","Human Sex Differences; Childhood Development; Black People; Cues; Hair; Intersectionality; Marginalization","","","","","","","","","","","","","","","","","","","","","","","","","","","","","","","","","","","","","","","","","","","","","",""
"5JJ3ATZB","journalArticle","2024","Yeo, GeckHong; Tong, Eddie M. W.","00_Trajectories of emotional disclosure with parents during the college transition among Asian first-year students","Developmental Psychology","","1939-0599","10.1037/dev0001781","","The college transition is a time of great emotional lability, and sharing emotional experiences with parents can be beneficial for first-year students. Guided by the social sharing of emotions framework and the cultural theory on self-construal, this study investigated the developmental course of freshmen’s emotional disclosure with parents during the first semester and the mediating role of independence-orientation in two Asian contexts—Beijing (China) and Singapore. Using experience sampling method (online diary), 205 Chinese freshmen (Mage = 19.43) and 291 Singapore freshmen (Mage = 19.44) reported on four facets of emotional disclosure with parents (frequency, intimacy, negativity, and positivity) across four timepoints and their independence–interdependence orientation (Time 1). Latent growth curve modeling comparing the two Asian samples revealed that frequency increased for Chinese students and decreased for Singapore students. Intimacy indicated upward trajectories for both Asian samples, whereas negativity and positivity showed downward trajectories but were less pronounced for Chinese students. Mediated latent growth curve modeling revealed that the cultures predicted independence-orientation, which in turn negatively predicted increase in frequency for the Singapore sample and positively predicted decrease for the Chinese sample. Independence-orientation negatively predicted increase in intimacy, positively predicted decline in negativity, and negatively predicted decline in positivity. In sum, we found complex and differentiated trajectories for the four facets of emotional disclosure in two Asian samples and the mediating role of independence-orientation in explaining cultural differences in the trajectories, which have implications for understanding emotional disclosure to parents during the developmental phase of the college transition in Asian contexts. (PsycInfo Database Record (c) 2024 APA, all rights reserved)","2024","2025-07-15 03:47:59","2025-07-30 04:30:09","","1935-1947","","10","60","","","","","","","","","","en-US","","","","","APA PsycNet","","Place: US Publisher: American Psychological Association","","D:\soft\Zotero\保存目录\storage\55EIKA7D\Yeo和Tong - 2024 - Trajectories of emotional disclosure with parents during the college transition among Asian first-ye.pdf","","","Parents; Simulation; College Students; Sharing (Social Behavior); Chinese Cultural Groups; College Transition; Intimacy; Positivism","","","","","","","","","","","","","","","","","","","","","","","","","","","","","","","","","","","","","","","","","","","","","",""
