"TW2RAIN9","journalArticle","2024","Dorri, Armin A.; Russell, Stephen T.","00_Being out in high school: Positive implications for well-being in three U.S. cohorts of sexual minority adults","Developmental Psychology","","1939-0599","10.1037/dev0001736","","For lesbian, gay, bisexual, or queer (i.e., sexual minority [SM]) youth, coming out is an important developmental milestone and is typically associated with positive well-being. However, coming out in high school may entail a higher risk of school-based victimization. Due to the greater risk of homophobic bullying, the implications of being out in adolescence and well-being later in adulthood remain unclear. Using data from a national probability survey (Generations Study) of three distinct age cohorts of SM adults (N = 1,474) in the United States, this study (a) examined how being out at school in adolescence affects general well-being in adulthood and (b) SM-specific well-being in adulthood, and (c) examined if these associations differ by cohort. Results from multivariate regression analyses demonstrated that being out in adolescence was not significantly associated with general well-being, but was significantly associated with SM-specific well-being: higher rates of identity centrality and community connectedness, and lower rates of internalized homophobia. There were no cohort differences in the associations between outness in high school, general well-being, and SM well-being. The findings from this national probability sample of SM adults provide novel insight into implications of being out across the life course, including the positive implications of being out at school in adolescence for SM-specific well-being in adulthood. (PsycInfo Database Record (c) 2025 APA, all rights reserved)","2024","2025-07-15 03:41:08","2025-07-30 00:19:21","","1131-1144","","6","60","","","Being out in high school","","","","","","","en-US","","","","","APA PsycNet","","Place: US Publisher: American Psychological Association","","D:\soft\Zotero\保存目录\storage\QGYIBYEK\Dorri和Russell - 2024 - Being out in high school Positive implications for well-being in three U.S. cohorts of sexual minor.pdf","","","Risk Factors; Sexual Minority Groups; Life Span; Well Being; Homosexuality (Attitudes Toward); Adolescent Attitudes; High Schools; Coming Out","","","","","","","","","","","","","","","","","","","","","","","","","","","","","","","","","","","","","","","","","","","","","",""
"NVC66BJG","journalArticle","2024","Bhatti, Dhanesha; Lane, Jonathan D.; Ronfard, Samuel","00_Updating trust: How children combine trait information with prior accuracy as they interact with an informant","Developmental Psychology","","1939-0599","10.1037/dev0001731","","When deciding whether to trust someone’s claims, how do children combine—over multiple interactions—information about that person’s general behavioral tendencies (traits) with that person’s ongoing (and changing) rate of providing accurate claims? Children aged 4–8 played 11 rounds of a find-the-sticker game. For each round, an informant looked into two cups and made a claim about which cup held a sticker. Children guessed the sticker’s location and the sticker’s actual location was revealed. Prior to the game, children received information that the informant was either honest or dishonest. In Study 1 (N = 201, 105 female, 96 male), the informant provided inaccurate information on the first five trials and then provided accurate information for the remaining trials (55% overall accuracy). In Study 2 (N = 144, 89 female, 55 male), the informant produced a less predictable pattern of (in)accuracy, but remained 55% accurate overall. The trait information children initially received about the informant’s honesty strongly influenced their epistemic trust when they lacked additional information about the informant’s reliability (the earliest trials). When children’s first-hand experiences with the informant prevented them from making strong predictions about the informant’s future behavior, only children approximately 7 years and older utilized trait information to guide their epistemic trust. These results demonstrate some similarities in children’s causal reasoning about the physical world and their social reasoning. The results also demonstrate developmental patterns in how children weigh different types of social information at different junctures in social interaction. (PsycInfo Database Record (c) 2024 APA, all rights reserved)","2024","2025-07-15 03:41:08","2025-07-30 00:16:25","","1145-1160","","6","60","","","Updating trust","","","","","","","en-US","","","","","APA PsycNet","","Place: US Publisher: American Psychological Association","","D:\soft\Zotero\保存目录\storage\4U7A5B94\Bhatti 等 - 2024 - Updating trust How children combine trait information with prior accuracy as they interact with an.pdf","","","Epistemology; Childhood Development; Trust (Social Behavior); Information; Games; Honesty; Experiences (Events); Informants","","","","","","","","","","","","","","","","","","","","","","","","","","","","","","","","","","","","","","","","","","","","","",""
"6NG8CCYY","journalArticle","2024","Afshordi, Narges; Li, Pearl Han; Koenig, Melissa","00_Trusting information from friends: Adults expect it but preschoolers do not","Developmental Psychology","","1939-0599","10.1037/dev0001761","","As adults, we might understand that beliefs often spread because people are strongly influenced by their friends, family, and other social connections. However, do we think those influences are strong enough to overrule direct evidence of a friend’s unreliability? And do preschoolers expect people to show such biases toward friends and to privilege friendship over reliability? Across three experiments, we explored whether friendship influences the evaluations of trust when others learn labels for novel objects as well as personal opinions. After watching scenes involving a main character, her best friend, and a stranger, preschoolers and adults judged who would be trusted for information from the main character’s perspective (third person) as well as their own (first person). Adults (n = 128, 55 female, recruited online from across the United States) expected the main character to trust information from her friend even if she had been previously inaccurate, while basing their own first-person judgments on accuracy. In contrast, 4- and 5-year-olds (n = 128, 62 female, from the United States) thought that the main character would be like themselves and prioritize accuracy over friendship. Further, preschoolers expected the main character to trust her (inaccurate) friend and (accurate) stranger equally when forming personal opinions. Thus, young children, unlike adults, do not expect others’ epistemic trust to privilege friendship with the speaker over accuracy information. (PsycInfo Database Record (c) 2024 APA, all rights reserved)","2024","2025-07-15 03:41:08","2025-07-30 00:15:47","","1161-1173","","6","60","","","Trusting information from friends","","","","","","","en-US","","","","","APA PsycNet","","Place: US Publisher: American Psychological Association","","D:\soft\Zotero\保存目录\storage\PZ782GVT\Afshordi 等 - 2024 - Trusting information from friends Adults expect it but preschoolers do not.pdf","","","Trust (Social Behavior); Friendship; Preschool Students; Information","","","","","","","","","","","","","","","","","","","","","","","","","","","","","","","","","","","","","","","","","","","","","",""
"PS4YZ5NR","journalArticle","2024","Jambon, Marc; Colasante, Tyler; Malti, Tina","00_Machiavellian behavior and social–emotional functioning in middle childhood and early adolescence","Developmental Psychology","","1939-0599","10.1037/dev0001755","","Machiavellianism is an antisocial interpersonal style involving the use of manipulative, deceptive, and coercive behaviors in the pursuit of self-interest. Although widely studied as a “dark” personality trait in adults, relatively little is known about the developmental correlates of Machiavellian tendencies earlier in life. The present study addressed this knowledge gap by examining associations between Machiavellian behavior and three theoretically relevant social–emotional domains—prosocial emotions, emotion recognition skills, and self-control—in a community sample of 7- and 11-year-old Canadian children (N = 300, 50% female). Of particular interest was the extent to which individual differences in social–emotional capacities were uniquely associated with Machiavellian behavior after controlling for aggression, a relatively well-studied antisocial behavior in childhood. Parents reported on children’s Machiavellian behavior and aggression. Social–emotional correlates were assessed via parent and child reports, behavioral tasks, and physiological assessments. Machiavellian behavior and aggression were similarly associated with lower parent-reported prosocial emotions and self-control. Machiavellian (but not aggressive) behavior was associated with lower child-reported guilt (a prosocial emotion), higher resting skin conductance levels (reflecting a general tendency for higher arousal), and better anger recognition. Semipartial correlational analyses indicated that these patterns of association with Machiavellian behaviors held independent of aggression. These findings indicate that, by middle childhood, Machiavellian behavior constitutes a distinct form of antisocial conduct that is associated with a unique social–emotional risk profile. (PsycInfo Database Record (c) 2025 APA, all rights reserved)","2024","2025-07-15 03:42:50","2025-07-30 00:27:11","","1175-1186","","7","60","","","","","","","","","","en-US","","","","","APA PsycNet","","Place: US Publisher: American Psychological Association","","D:\soft\Zotero\保存目录\storage\84Z2UVYC\Jambon 等 - 2024 - Machiavellian behavior and social–emotional functioning in middle childhood and early adolescence.pdf","","","Emotions; Antisocial Behavior; Parents; Early Adolescence; Early Childhood Development; Socioemotional Functioning; Aggressive Behavior; Machiavellianism","","","","","","","","","","","","","","","","","","","","","","","","","","","","","","","","","","","","","","","","","","","","","",""
"AYNYDZIC","journalArticle","2024","Hok, Hannah; Vasquez, Katie; Barakzai, Anam; Shaw, Alex","00_The nonmeek inherit the earth: Children generalize dominance, but not submissiveness","Developmental Psychology","","1939-0599","10.1037/dev0001696","","Children and even infants have clear intuitions about power early in development; they can infer who is dominant and subordinate from observing a single interaction. However, it is unclear what children infer about each individual’s status from these interactions—do they think dominants and subordinates will maintain their status when interacting with novel partners? In three experiments, we investigate this question. Children (4- to 10-year-olds, N = 365) heard stories about a dominant and subordinate agent and predicted the dominant or subordinate agent’s behavior with a novel agent. In all studies, we found that 7- to 10-year-olds generalized dominance, thinking the dominant would again be dominant or “in charge,” both for social power (e.g., granting permission) in Study 1 and physical dominance (e.g., a fistfight) in Studies 2 and 3. Furthermore, although they believed dominant agents would win dominance contests (fistfights), they did not believe they would win contests unrelated to dominance (math contests). Younger children did not generalize social power (Study 1) but did generalize physical dominance (Studies 2 and 3). However, even for physical dominance, their generalizations were less selective (i.e., they believed the dominant would win fistfights and math contests). Notably, neither age group generalized an agent’s submissiveness in any of the studies—they did not believe a subordinate agent would again be subordinate when paired with a novel partner. We discuss how these results extend past work on children’s developing intuitions about dominance and prompt deeper questions about the inferences children draw from dominance interactions. (PsycInfo Database Record (c) 2024 APA, all rights reserved)","2024","2025-07-15 03:42:50","2025-07-30 00:27:38","","1187-1202","","7","60","","","The nonmeek inherit the earth","","","","","","","en-US","","","","","APA PsycNet","","Place: US Publisher: American Psychological Association","","D:\soft\Zotero\保存目录\storage\A2ULSKYM\Hok 等 - 2024 - The nonmeek inherit the earth Children generalize dominance, but not submissiveness.pdf","","","Social Cognition; Childhood Development; Partners; Dominance; Dominance Hierarchy; Intuition; Obedience; Physical Strength","","","","","","","","","","","","","","","","","","","","","","","","","","","","","","","","","","","","","","","","","","","","","",""
"NH9J9PXV","journalArticle","2024","Fleece, Hailey; Wagner, Nicholas J.; Chronis-Tuscano, Andrea; Smith, Kelly A.; Novick, Danielle R.; Druskin, Lindsay R.; Shakiba, Nila; Danko, Christina M.; Rubin, Kenneth H.","00_Can behaviorally inhibited preschoolers make friends?","Developmental Psychology","","1939-0599","10.1037/dev0001742","","Preschoolers who display extremely inhibited behavior are at risk for the development of anxiety disorders. However, behavioral inhibition (BI) is a multifaceted characteristic. Some children with BI are fearful when confronted by unfamiliar adults, peers, and objects; others are fearful when separated from their parents. In the present study, we examined specific features of BI that predicted observed friendship formation among preschoolers who are behaviorally inhibited. We also examined whether teacher ratings of classroom behaviors predicted friendship formation. Sixty highly inhibited children (35 female, Mage = 52.57 months) were observed during eight weekly free-play sessions with initially unfamiliar inhibited peers. Free-play periods occurred before weekly intervention sessions for children with BI and their parents. An observational protocol was developed to identify children who made a friend during the eight weekly sessions. Before the first session, different subtypes of BI were assessed by parents; preschool teachers assessed the children’s classroom behaviors with familiar peers. Twenty-six children met the criteria for having made and kept a friend. Probit regression analyses revealed that parent ratings of BI among unfamiliar peers and teacher ratings of children’s social anxiety before the intervention were associated with a decreased probability of making a friend. No evidence was found linking children’s responses to the intervention and friendship formation. Results suggest that extremelyinhibited preschoolers are capable of making friends. Implications for future research and intervention efforts that focus on individual differences of children with BI are discussed. (PsycInfo Database Record (c) 2024 APA, all rights reserved)","2024","2025-07-15 03:42:50","2025-07-30 00:28:33","","1203-1213","","7","60","","","","","","","","","","en-US","","","","","APA PsycNet","","Place: US Publisher: American Psychological Association","","D:\soft\Zotero\保存目录\storage\UJWK7A5M\Fleece 等 - 2024 - Can behaviorally inhibited preschoolers make friends.pdf","","","Parents; Friendship; Peers; Preschool Students; Behavioral Inhibition; Social Skills; Classroom Behavior; Social Withdrawal","","","","","","","","","","","","","","","","","","","","","","","","","","","","","","","","","","","","","","","","","","","","","",""
"SHQRJZB5","journalArticle","2024","Platts, Cory R.; Sturge-Apple, Melissa L.; Davies, Patrick T.","00_Hostile interparental conflict and parental discipline: Romantic attachment as a spillover mechanism","Developmental Psychology","","1939-0599","10.1037/dev0001753","","This study examined parental romantic attachment security as a mediator of prospective associations between hostile interparental conflict and parental discipline (i.e., power-assertive, permissive, and inductive discipline) for mothers and fathers of young children. Furthermore, this study utilized a novel, automatic assessment of romantic attachment security in examining whether romantic attachment assessed at controlled (i.e., self-reported) and automatic (i.e., a rapid word-sorting task) levels of representation differentially serve as spillover mechanisms. Participants included 235 mothers (62% White), fathers (55% White), and a target child between the ages of 2 and 4 (Mage = 2.97; 55% girls) recruited from a moderate-sized metropolitan area in the Northeastern United States. Families were assessed annually across three waves of data collection. Results from autoregressive structural equation model analyses revealed that romantic attachment operated as spillover mechanism for mothers. In particular, hostile interparental conflict was associated with power-assertive discipline through changes in mothers’ automatic romantic attachment security. We also found that hostile interparental conflict was associated with inductive discipline through changes in mothers’ romantic attachment avoidance. Neither controlled nor automatic romantic attachment representations served as spillover mechanisms for fathers. Findings are discussed within family systems and attachment frameworks. (PsycInfo Database Record (c) 2024 APA, all rights reserved)","2024","2025-07-15 03:42:50","2025-07-30 00:29:07","","1214-1226","","7","60","","","Hostile interparental conflict and parental discipline","","","","","","","en-US","","","","","APA PsycNet","","Place: US Publisher: American Psychological Association","","D:\soft\Zotero\保存目录\storage\KH6J6XJH\Platts 等 - 2024 - Hostile interparental conflict and parental discipline Romantic attachment as a spillover mechanism.pdf","","","Mothers; Family Conflict; Fathers; Attachment Behavior; Child Discipline; Hostility; Romance","","","","","","","","","","","","","","","","","","","","","","","","","","","","","","","","","","","","","","","","","","","","","",""
"ECDW7MTL","journalArticle","2024","Corbit, John; MacDougall, Hayley; Hartlin, Stephanie; Moore, Chris","00_The role of affiliation in the development of collaborative partner choice","Developmental Psychology","","1939-0599","10.1037/dev0001739","","Collaboration is an early emerging component of successful cooperative relations that produces a cascade of positive social preferences between collaborators. Concurrently, robust preferences for affiliated others may restrict these benefits to in-group peers. We investigated how in-group affiliation (based on minimal group markers) and interpersonal affiliation (based on shared preferences) influence children’s collaborative partner choice. We asked whether children prefer to collaborate with affiliated peers and if highlighting interpersonal affiliation with out-group members reduce in-group bias in partner choice. In Study 1, we assigned children (4–9 years, N = 124, 62 female, two nonbinary) to either a group or interpersonal affiliation condition and gave them a choice of collaborating with either an affiliated (in-group or same preference) or unaffiliated (out-group or different preference) peer. While children preferred affiliated peers in both conditions, interpersonal affiliation had a greater influence than group affiliation on collaborative partner choice among younger participants. With age, the difference between children’s preference for affiliated peers in the interpersonal and group affiliation condition declined until they were similar in middle childhood. In Study 2, we assessed whether shared preferences would override in-group bias when these factors were directly contrasted. Children (4–9 years, N = 62, 33 female) chose between an in-group/different preference or out-group/same preferences peer. Younger children preferred the out-group/same preference peer, a preference that diminished with age to chance levels in middle childhood. These findings suggest that affiliation is an important determinant of collaborative partner choice and that shared preferences can override in-group bias in children’s collaborative partner choice. (PsycInfo Database Record (c) 2024 APA, all rights reserved)","2024","2025-07-15 03:42:50","2025-07-30 00:29:51","","1227-1236","","7","60","","","","","","","","","","en-US","","","","","APA PsycNet","","Place: US Publisher: American Psychological Association","","D:\soft\Zotero\保存目录\storage\JRAXJXCF\Corbit 等 - 2024 - The role of affiliation in the development of collaborative partner choice.pdf","","","Childhood Development; Preferences; Interpersonal Relationships; Peers; Partners; Choice Behavior; Collaboration; Ingroup Outgroup","","","","","","","","","","","","","","","","","","","","","","","","","","","","","","","","","","","","","","","","","","","","","",""
"I99LYMKW","journalArticle","2024","AuBuchon, Angela M.; Wagner, Rebecca L.; Sackinsky, Margaret","00_Children’s rehearsal development parallels that of self-talk in other executive functions","Developmental Psychology","","1939-0599","10.1037/dev0001697","","Rehearsal is a form of self-talk used to support short-term memory. Historically, the study of rehearsal development has diverged from the study of self-talk more generally. The current experiment examines whether two characteristics of self-talk (impact of task difficulty and self-talk’s narrative vs. planning purpose) are also observed in rehearsal. Eighty children, ages 4–7, were tasked with remembering the three-item and six-item lists over a 15-s delay. Children’s spontaneous use of fixed rehearsal (i.e., immediate repetition of a just-presented item) and cumulative rehearsal (i.e., cycling through multiple items at a time) was documented from video recordings. Four-year-olds narrated item presentations using fixed rehearsal. Six- and seven-year-olds proactively planned for recall by engaging cumulative rehearsal. Five-year-olds used both forms of rehearsal, but their frequency of cumulative rehearsal was dependent on list length. Therefore, rehearsal is susceptible to task manipulations that affect other forms of self-talk. (PsycInfo Database Record (c) 2024 APA, all rights reserved)","2024","2025-07-15 03:42:50","2025-07-30 00:30:29","","1237-1243","","7","60","","","","","","","","","","en-US","","","","","APA PsycNet","","Place: US Publisher: American Psychological Association","","D:\soft\Zotero\保存目录\storage\EET6PY32\AuBuchon 等 - 2024 - Children’s rehearsal development parallels that of self-talk in other executive functions.pdf","","","Childhood Development; Cognitive Ability; Short Term Memory; Practice; Self-Talk","","","","","","","","","","","","","","","","","","","","","","","","","","","","","","","","","","","","","","","","","","","","","",""
"78GVGKWD","journalArticle","2024","Gardier, Marion; Geurten, Marie","00_The developmental path of metacognition from toddlerhood to early childhood and its influence on later memory performance","Developmental Psychology","","1939-0599","10.1037/dev0001752","","Recently, several studies have suggested that metacognition emerges early in infancy and toddlerhood. However, to date, the developmental trajectory of these early metacognitive monitoring and control processes and their influence on children’s later memory functioning remains poorly understood. The aim of this study was to longitudinally document the development of metacognition between the ages of 2.5 and 4.5 years and to examine the link between these early metacognitive skills and later memory performance. To do so, 69 children initially aged 29–33 months old (NT0 = 69; 32 females; Mage = 32.3 months; SD = 1.6) were tested at three time points (12-month intervals) with a recognition memory paradigm designed to assess both metacognitive monitoring, through retrospective confidence judgment, and metacognitive control, through a cue selection task (i.e., children had the opportunity to ask for a cue to help them change their memory decision). In addition, at the last session, an episodic memory task (story recall) was also administered. Our results revealed an improvement in monitoring and control processes between 2.5 and 4.5 years with above-chance performance from around age 3.5. Mixed-effects modeling also indicated that metacognitive monitoring at ages 2.5 and 4.5, but not—unexpectedly—metacognitive control, was related to children’s memory performance at age 4.5. Overall, our results provide evidence to enhance our understanding of the developmental course of metacognition from toddlerhood to early childhood and suggest that metacognitive processes are involved in memory performance much earlier than had previously been shown. (PsycInfo Database Record (c) 2024 APA, all rights reserved)","2024","2025-07-15 03:42:50","2025-07-30 00:31:40","","1244-1254","","7","60","","","","","","","","","","en-US","","","","","APA PsycNet","","Place: US Publisher: American Psychological Association","","D:\soft\Zotero\保存目录\storage\24Q5DDIQ\Gardier和Geurten - 2024 - The developmental path of metacognition from toddlerhood to early childhood and its influence on lat.pdf","","","Memory; Cognitive Development; Metacognition; Early Childhood Development; Early Memories; Retrospective Memory","","","","","","","","","","","","","","","","","","","","","","","","","","","","","","","","","","","","","","","","","","","","","",""
