"PTXWH8UV","journalArticle","2024","Nussenbaum, Kate; Katzman, Perri L.; Lu, Hanxiao; Zorowitz, Samuel; Hartley, Catherine A.","00_Sensitivity to the Instrumental Value of Choice Increases Across Development","Psychological Science","","0956-7976","10.1177/09567976241256961","https://doi.org/10.1177/09567976241256961","Across development, people tend to demonstrate a preference for contexts in which they have the opportunity to make choices. However, it is not clear how children, adolescents, and adults learn to calibrate this preference based on the costs and benefits of agentic choice. Here, in both a primary, in-person, reinforcement-learning experiment (N = 92; age range = 10–25 years) and a preregistered online replication study (N = 150; age range = 8–25 years), we found that participants overvalued agentic choice but also calibrated their agency decisions to the reward structure of the environment, increasingly selecting agentic choice when choice had greater instrumental value. Regression analyses and computational modeling of participant choices revealed that participants’ bias toward agentic choice—reflecting its intrinsic value—remained consistent across age, whereas sensitivity to the instrumental value of agentic choice increased from childhood to early adulthood.","2024-08-01","2025-07-15 03:26:38","2025-09-10 13:54:30","2025-07-15 03:26:38","933-947","","8","35","","Psychol Sci","","","","","","","","EN","","","","","SAGE Journals","","Publisher: SAGE Publications Inc","","D:\soft\Zotero\保存目录\storage\4LX88VYN\Nussenbaum 等 - 2024 - Sensitivity to the Instrumental Value of Choice Increases Across Development.pdf","","","","","","","","","","","","","","","","","","","","","","","","","","","","","","","","","","","","","","","","","","","","","","","","",""
"VCF3NGZG","journalArticle","2024","Prinzing, Michael","00_Proenvironmental Behavior Increases Subjective Well-Being: Evidence From an Experience-Sampling Study and a Randomized Experiment","Psychological Science","","0956-7976","10.1177/09567976241251766","https://doi.org/10.1177/09567976241251766","Two preregistered studies investigated whether engaging in proenvironmental behavior increases a person’s well-being. A 10-day experience-sampling study (7,161 observations from 181 adults in 14 countries, primarily the United States) revealed positive within-person and between-person associations, and a randomized controlled experiment (N = 545 U.S. undergraduates) found that incorporating proenvironmental behavior into individuals’ daily activities increased their experiences of happiness and meaning in life. Indeed, the effect was comparable to incorporating activities selected specifically to elicit such positive states, though these results may be affected by demand characteristics. The studies also offered some tentative preliminary evidence about why such an effect might emerge. There was some support for the hypothesis that proenvironmental behavior affects well-being by creating a “warm glow.” But overall the findings align more closely with the hypothesis that proenvironmental behavior helps to satisfy individuals’ basic psychological needs.","2024-09-01","2025-07-15 03:27:44","2025-09-10 13:54:33","2025-07-15 03:27:24","951-961","","9","35","","Psychol Sci","Proenvironmental Behavior Increases Subjective Well-Being","","","","","","","EN","","","","","SAGE Journals","","Publisher: SAGE Publications Inc","","D:\soft\Zotero\保存目录\storage\BUUNMP3T\Prinzing - 2024 - Proenvironmental Behavior Increases Subjective Well-Being Evidence From an Experience-Sampling Stud.pdf","","","","","","","","","","","","","","","","","","","","","","","","","","","","","","","","","","","","","","","","","","","","","","","","",""
"75ARJJBE","journalArticle","2024","Townsend, Charlotte H.; Mishra, Sonya; Kray, Laura J.","00_Not All Powerful People Are Created Equal: An Examination of Gender and Pathways to Social Hierarchy Through the Lens of Social Cognition","Psychological Science","","0956-7976","10.1177/09567976241260251","https://doi.org/10.1177/09567976241260251","Across four studies (N = 816 U.S. adults), we uncovered a gender stereotype about dual pathways to social hierarchy: Men were associated with power, and women were associated with status. We detected this pattern both explicitly and implicitly in perceptions of individuals drawn from Forbes magazine’s powerful people lists in undergraduate and online samples. We examined social-cognitive implications, including prominent people’s degree of recognition by individuals and society, and the formation of men’s and women’s self-concepts. We found that power (status) ratings predicted greater recognition of men (women) and lesser recognition of women (men). In terms of the self-concept, we found that women internalized the stereotype associating women with status more than power implicitly and explicitly. Although men explicitly reported having less status and more power than women, men implicitly associated the self with status as much as power. No gender differences emerged in the desires for power and status.","2024-09-01","2025-07-15 03:27:44","2025-09-10 13:54:36","2025-07-15 03:27:28","962-975","","9","35","","Psychol Sci","Not All Powerful People Are Created Equal","","","","","","","EN","","","","","SAGE Journals","","Publisher: SAGE Publications Inc","","D:\soft\Zotero\保存目录\storage\3RARR8T7\Townsend 等 - 2024 - Not All Powerful People Are Created Equal An Examination of Gender and Pathways to Social Hierarchy.pdf","","","","","","","","","","","","","","","","","","","","","","","","","","","","","","","","","","","","","","","","","","","","","","","","",""
"TFAY2H2C","journalArticle","2024","Heltzel, Gordon; Laurin, Kristin","00_Why Twitter Sometimes Rewards What Most People Disapprove of: The Case of Cross-Party Political Relations","Psychological Science","","0956-7976","10.1177/09567976241258149","https://doi.org/10.1177/09567976241258149","Recent evidence has shown that social-media platforms like Twitter (now X) reward politically divisive content, even though most people disapprove of interparty conflict and negativity. We document this discrepancy and provide the first evidence explaining it, using tweets by U.S. Senators and American adults’ responses to them. Studies 1a and 1b examined 6,135 such tweets, finding that dismissing tweets received more Likes and Retweets than tweets that engaged constructively with opponents. In contrast, Studies 2a and 2b (N = 856; 1,968 observations) revealed that the broader public, if anything, prefers politicians’ engaging tweets. Studies 3 (N = 323; 4,571 observations) and 4 (N = 261; 2,610 observations) supported two distinct explanations for this disconnect. First, users who frequently react to politicians’ tweets are an influential yet unrepresentative minority, rewarding dismissing posts because, unlike most people, they prefer them. Second, the silent majority admit that they too would reward dismissing posts more, despite disapproving of them. These findings help explain why popular online content sometimes distorts true public opinion.","2024-09-01","2025-07-15 03:27:44","2025-09-10 13:54:39","2025-07-15 03:27:30","976-994","","9","35","","Psychol Sci","Why Twitter Sometimes Rewards What Most People Disapprove of","","","","","","","EN","","","","","SAGE Journals","","Publisher: SAGE Publications Inc","","D:\soft\Zotero\保存目录\storage\EEM4G7LD\Heltzel和Laurin - 2024 - Why Twitter Sometimes Rewards What Most People Disapprove of The Case of Cross-Party Political Rela.pdf","","","","","","","","","","","","","","","","","","","","","","","","","","","","","","","","","","","","","","","","","","","","","","","","",""
"56RBPE4E","journalArticle","2024","Tsubomi, Hiroyuki; Fukuda, Keisuke; Kikumoto, Atsushi; Mayr, Ulrich; Vogel, Edward K.","00_Task Termination Triggers Spontaneous Removal of Information From Visual Working Memory","Psychological Science","","0956-7976","10.1177/09567976241246709","https://doi.org/10.1177/09567976241246709","Working memory (WM) is a goal-directed memory system that actively maintains a limited amount of task-relevant information to serve the current goal. By this definition, WM maintenance should be terminated after the goal is accomplished, spontaneously removing no-longer-relevant information from WM. Past studies have failed to provide direct evidence of spontaneous removal of WM content by allowing participants to engage in a strategic reallocation of WM resources to competing information within WM. By contrast, we provide direct neural and behavioral evidence that visual WM content can be largely removed less than 1 s after it becomes obsolete, in the absence of a strategic allocation of resources (total N = 442 adults). These results demonstrate that visual WM is intrinsically a goal-directed system, and spontaneous removal provides a means for capacity-limited WM to keep up with ever-changing demands in a dynamic environment.","2024-09-01","2025-07-15 03:27:44","2025-09-10 13:54:43","2025-07-15 03:27:32","995-1009","","9","35","","Psychol Sci","","","","","","","","EN","","","","","SAGE Journals","","Publisher: SAGE Publications Inc","","D:\soft\Zotero\保存目录\storage\RVVM68QC\Tsubomi 等 - 2024 - Task Termination Triggers Spontaneous Removal of Information From Visual Working Memory.pdf","","","","","","","","","","","","","","","","","","","","","","","","","","","","","","","","","","","","","","","","","","","","","","","","",""
"CFVACTFV","journalArticle","2024","Oktar, Kerem; Lombrozo, Tania; Griffiths, Thomas L.","00_Learning From Aggregated Opinion","Psychological Science","","0956-7976","10.1177/09567976241251741","https://doi.org/10.1177/09567976241251741","The capacity to leverage information from others’ opinions is a hallmark of human cognition. Consequently, past research has investigated how we learn from others’ testimony. Yet a distinct form of social information—aggregated opinion—increasingly guides our judgments and decisions. We investigated how people learn from such information by conducting three experiments with participants recruited online within the United States (N = 886) comparing the predictions of three computational models: a Bayesian solution to this problem that can be implemented by a simple strategy for combining proportions with prior beliefs, and two alternatives from epistemology and economics. Across all studies, we found the strongest concordance between participants’ judgments and the predictions of the Bayesian model, though some participants’ judgments were better captured by alternative strategies. These findings lay the groundwork for future research and show that people draw systematic inferences from aggregated opinion, often in line with a Bayesian solution.","2024-09-01","2025-07-15 03:27:44","2025-09-10 13:54:47","2025-07-15 03:27:34","1010-1024","","9","35","","Psychol Sci","","","","","","","","EN","","","","","SAGE Journals","","Publisher: SAGE Publications Inc","","D:\soft\Zotero\保存目录\storage\5RTAT5HU\Oktar 等 - 2024 - Learning From Aggregated Opinion.pdf","","","","","","","","","","","","","","","","","","","","","","","","","","","","","","","","","","","","","","","","","","","","","","","","",""
"SCALZTXZ","journalArticle","2024","Prowten, Skyler; Walker, Emily; London, Brian; Pearce, Elizabeth; Napoli, Angela; Chenevert, Bailey; Clevenger, Christian; Smith, Andrew R.","00_Does Physiological Arousal Increase Social Transmission of Information? Two Replications of Berger (2011)","Psychological Science","","0956-7976","10.1177/09567976241257255","https://doi.org/10.1177/09567976241257255","People share information for many reasons. For example, Berger (2011, N = 40) found that undergraduate participants manipulated to have higher physiological arousal were more likely to share a news article with others via email than people who had low arousal. Berger’s research is widely cited as evidence of the causal role of arousal in sharing information and has been used to explain why information that induces high-arousal emotions is shared more than information that induces low-arousal emotions. We conducted two replications (N = 111, N = 160) of Berger’s study, using the same arousal manipulation but updating the sharing measure to reflect the rise of information sharing through social media. Both studies failed to find an impact of incidental physiological arousal on undergraduate participants’ willingness to share news articles on social media. Our studies cast doubt on the idea that incidental physiological arousal—in the absence of other factors—impacts people’s decisions to share information on social networking sites.","2024-09-01","2025-07-15 03:27:44","2025-09-10 13:54:50","2025-07-15 03:27:37","1025-1034","","9","35","","Psychol Sci","Does Physiological Arousal Increase Social Transmission of Information?","","","","","","","EN","","","","","SAGE Journals","","Publisher: SAGE Publications Inc","","D:\soft\Zotero\保存目录\storage\4RSJ8XK6\Prowten 等 - 2024 - Does Physiological Arousal Increase Social Transmission of Information Two Replications of Berger (.pdf","","","","","","","","","","","","","","","","","","","","","","","","","","","","","","","","","","","","","","","","","","","","","","","","",""
"I4GNUSPH","journalArticle","2024","Xu, Luzi; Paffen, Chris L. E.; Van der Stigchel, Stefan; Gayet, Surya","00_Statistical Learning Facilitates Access to Awareness","Psychological Science","","0956-7976","10.1177/09567976241263344","https://doi.org/10.1177/09567976241263344","Statistical learning is a powerful mechanism that enables the rapid extraction of regularities from sensory inputs. Although numerous studies have established that statistical learning serves a wide range of cognitive functions, it remains unknown whether statistical learning impacts conscious access. To address this question, we applied multiple paradigms in a series of experiments (N = 153 adults): Two reaction-time-based breaking continuous flash suppression (b-CFS) experiments showed that probable objects break through suppression faster than improbable objects. A preregistered accuracy-based b-CFS experiment showed higher localization accuracy for suppressed probable (versus improbable) objects under identical presentation durations, thereby excluding the possibility of processing differences emerging after conscious access (e.g., criterion shifts). Consistent with these findings, a supplemental visual-masking experiment reaffirmed higher localization sensitivity to probable objects over improbable objects. Together, these findings demonstrate that statistical learning alters the competition for scarce conscious resources, thereby potentially contributing to established effects of statistical learning on higher-level cognitive processes that require consciousness.","2024-09-01","2025-07-15 03:27:44","2025-09-10 13:54:54","2025-07-15 03:27:39","1035-1047","","9","35","","Psychol Sci","","","","","","","","EN","","","","","SAGE Journals","","Publisher: SAGE Publications Inc","","D:\soft\Zotero\保存目录\storage\J268C78I\Xu 等 - 2024 - Statistical Learning Facilitates Access to Awareness.pdf","","","","","","","","","","","","","","","","","","","","","","","","","","","","","","","","","","","","","","","","","","","","","","","","",""
"9XWPCGQS","journalArticle","2024","Herzenstein, Michal; Rosario, Sanjana; Oblander, Shin; Netzer, Oded","02_The Language of (Non)Replicable Social Science","Psychological Science","","0956-7976","10.1177/09567976241254037","https://doi.org/10.1177/09567976241254037","Using publicly available data from 299 preregistered replications from the social sciences, we found that the language used to describe a study can predict its replicability above and beyond a large set of controls related to the article characteristics, study design and results, author information, and replication effort. To understand why, we analyzed the textual differences between replicable and nonreplicable studies. Our findings suggest that the language in replicable studies is transparent and confident, written in a detailed and complex manner, and generally exhibits markers of truthful communication, possibly demonstrating the researchers’ confidence in the study. Nonreplicable studies, however, are vaguely written and have markers of persuasion techniques, such as the use of positivity and clout. Thus, our findings allude to the possibility that authors of nonreplicable studies are more likely to make an effort, through their writing, to persuade readers of their (possibly weaker) results.","2024-09-01","2025-07-15 03:27:44","2025-09-10 13:34:55","2025-07-15 03:27:41","1048-1061","","9","35","","Psychol Sci","","","","","","","","EN","","","","","SAGE Journals","","Publisher: SAGE Publications Inc","","D:\soft\Zotero\保存目录\storage\55GX93BB\Herzenstein 等 - 2024 - The Language of (Non)Replicable Social Science.pdf","","","","","","","","","","","","","","","","","","","","","","","","","","","","","","","","","","","","","","","","","","","","","","","","",""
"GSSQ4F9M","journalArticle","2024","Sullivan, Alexandra D. W.; Merrill, Sarah M.; Konwar, Chaini; Coccia, Michael; Rivera, Luisa; MacIsaac, Julia L.; Lieberman, Alicia F.; Kobor, Michael S.; Bush, Nicole R.","00_Intervening After Trauma: Child–Parent Psychotherapy Treatment Is Associated With Lower Pediatric Epigenetic Age Acceleration","Psychological Science","","0956-7976","10.1177/09567976241260247","https://doi.org/10.1177/09567976241260247","Early-life adversity increases the risk of health problems. Interventions supporting protective and responsive caregiving offer a promising approach to attenuating adversity-induced changes in stress-sensitive biomarkers. This study tested whether participation in an evidence-based dyadic psychosocial intervention, child–parent psychotherapy (CPP), was related to lower epigenetic age acceleration, a trauma-sensitive biomarker of accelerated biological aging that is associated with later health impairment, in a sample of children with trauma histories. Within this quasi-experimental, repeated-measures study, we examined epigenetic age acceleration at baseline and postintervention in a low-income sample of children receiving CPP treatment (n = 45; age range = 2–6 years; 76% Latino) compared with a weighted, propensity-matched community-comparison sample (n = 110; age range = 3–6 years; 40% Latino). Baseline epigenetic age acceleration was equivalent across groups. However, posttreatment, epigenetic age acceleration in the treatment group was lower than in the matched community sample. Findings highlight the potential for a dyadic psychosocial intervention to ameliorate accelerated biological aging in trauma-exposed children.","2024-09-01","2025-07-15 03:27:44","2025-09-10 13:54:58","2025-07-15 03:27:44","1062-1073","","9","35","","Psychol Sci","Intervening After Trauma","","","","","","","EN","","","","","SAGE Journals","","Publisher: SAGE Publications Inc","","D:\soft\Zotero\保存目录\storage\UPP8TXRY\Sullivan 等 - 2024 - Intervening After Trauma Child–Parent Psychotherapy Treatment Is Associated With Lower Pediatric Ep.pdf","","","","","","","","","","","","","","","","","","","","","","","","","","","","","","","","","","","","","","","","","","","","","","","","",""
"I3GVW9S2","journalArticle","2024","Sels, Laura; Erbas, Yasemin; O’Brien, Sarah T.; Verhofstadt, Lesley; Clark, Margaret S.; Kalokerinos, Elise K.","00_The Double-Edged Sword of Social Sharing: Social Sharing Predicts Increased Emotion Differentiation When Rumination Is Low but Decreased Emotion Differentiation When Rumination Is High","Psychological Science","","0956-7976","10.1177/09567976241266513","https://doi.org/10.1177/09567976241266513","Laypeople believe that sharing their emotional experiences with others will improve their understanding of those experiences, but no clear empirical evidence supports this belief. To address this gap, we used data from four daily life studies (N = 659; student and community samples) to explore the association between social sharing and subsequent emotion differentiation, which involves labeling emotions with a high degree of complexity. Contrary to our expectations, we found that social sharing of emotional experiences was linked to greater subsequent emotion differentiation on occasions when people ruminated less than usual about these experiences. In contrast, on occasions when people ruminated more than usual about their experiences, social sharing of these experiences was linked to lower emotion differentiation. These effects held when we controlled for levels of negative emotion. Our findings suggest that putting feelings into words through sharing may only enable emotional precision when that sharing occurs without dwelling or perseverating.","2024-10-01","2025-07-15 03:28:39","2025-09-10 13:55:01","2025-07-15 03:28:22","1079-1093","","10","35","","Psychol Sci","The Double-Edged Sword of Social Sharing","","","","","","","EN","","","","","SAGE Journals","","Publisher: SAGE Publications Inc","","D:\soft\Zotero\保存目录\storage\JIKACDAR\Sels 等 - 2024 - The Double-Edged Sword of Social Sharing Social Sharing Predicts Increased Emotion Differentiation.pdf","","","","","","","","","","","","","","","","","","","","","","","","","","","","","","","","","","","","","","","","","","","","","","","","",""
"H9HCE5RR","journalArticle","2024","Kanngiesser, Patricia; Sunderarajan, Jahnavi; Hafenbrädl, Sebastian; Woike, Jan K.","00_Children Sustain Cooperation in a Threshold Public-Goods Game Even When Seeing Others’ Outcomes","Psychological Science","","0956-7976","10.1177/09567976241267854","https://doi.org/10.1177/09567976241267854","Many societal challenges are threshold dilemmas requiring people to cooperate to reach a threshold before group benefits can be reaped. Yet receiving feedback about others’ outcomes relative to one’s own (relative feedback) can undermine cooperation by focusing group members’ attention on outperforming each other. We investigated the impact of relative feedback compared to individual feedback (only seeing one’s own outcome) on cooperation in children from Germany and India (6- to 10-year-olds, N = 240). Using a threshold public-goods game with real water as a resource, we show that, although feedback had an effect, most groups sustained cooperation at high levels in both feedback conditions until the end of the game. Analyses of children’s communication (14,374 codable utterances) revealed more references to social comparisons and more verbal efforts to coordinate in the relative-feedback condition. Thresholds can mitigate the most adverse effects of social comparisons by focusing attention on a common goal.","2024-10-01","2025-07-15 03:28:39","2025-09-10 13:55:04","2025-07-15 03:28:27","1094-1107","","10","35","","Psychol Sci","","","","","","","","EN","","","","","SAGE Journals","","Publisher: SAGE Publications Inc","","D:\soft\Zotero\保存目录\storage\9YAJJP2B\Kanngiesser 等 - 2024 - Children Sustain Cooperation in a Threshold Public-Goods Game Even When Seeing Others’ Outcomes.pdf","","","","","","","","","","","","","","","","","","","","","","","","","","","","","","","","","","","","","","","","","","","","","","","","",""
"WR2ZRZQ7","journalArticle","2024","Jones, Henry M.; Diaz, Gisella K.; Ngiam, William X. Q.; Awh, Edward","00_Electroencephalogram Decoding Reveals Distinct Processes for Directing Spatial Attention and Encoding Into Working Memory","Psychological Science","","0956-7976","10.1177/09567976241263002","https://doi.org/10.1177/09567976241263002","Past work reveals a tight relationship between spatial attention and storage in visual working memory. But is spatially attending an item tantamount to working memory encoding? Here, we tracked electroencephalography (EEG) signatures of spatial attention and working memory encoding while independently manipulating the number of memory items and the spatial extent of attention in two studies of adults (N = 39; N = 33). Neural measures of spatial attention tracked the position and size of the attended area independent of the number of individuated items encoded into working memory. At the same time, multivariate decoding of the number of items stored in working memory was insensitive to variations in the breadth and position of spatial attention. Finally, representational similarity analyses provided converging evidence for a pure load signal that is insensitive to the spatial extent of the stored items. Thus, although spatial attention is a persistent partner of visual working memory, it is functionally dissociable from the selection and maintenance of individuated representations in working memory.","2024-10-01","2025-07-15 03:28:39","2025-09-10 13:55:09","2025-07-15 03:28:29","1108-1138","","10","35","","Psychol Sci","","","","","","","","EN","","","","","SAGE Journals","","Publisher: SAGE Publications Inc","","D:\soft\Zotero\保存目录\storage\S4EMKH2B\Jones 等 - 2024 - Electroencephalogram Decoding Reveals Distinct Processes for Directing Spatial Attention and Encodin.pdf","","","","","","","","","","","","","","","","","","","","","","","","","","","","","","","","","","","","","","","","","","","","","","","","",""
